client_id	path	sentence	up_votes	down_votes	age	gender	accent
spk1	dev0602.mp3	わたしは七時半に起きます。			twenties	male	
spk1	dev0603.mp3	風やら雨やらで、我々の散歩は台無しだった。			twenties	male	
spk1	dev0604.mp3	父が病気になったので、私達は少ない収入で暮らして行かなくてはならなかった。			twenties	male	
spk1	dev0605.mp3	あらゆる現実を、すべて自分のほうへねじ曲げたのだ。			twenties	male	
spk1	dev0606.mp3	服を着ましたか。			twenties	male	
spk1	dev0607.mp3	彼女をしからないで。幼くて理解できないから。			twenties	male	
spk1	dev0608.mp3	カレーはインドの食べ物です。			twenties	male	
spk1	dev0609.mp3	不良たちは彼を殴り倒して財布を奪った。			twenties	male	
spk1	dev0610.mp3	父は新聞にざっと目をとおした。			twenties	male	
spk1	dev0611.mp3	彼女は病気のために来ることが出来なかった。			twenties	male	
spk1	dev0612.mp3	彼女は本当に犬が嫌いです。			twenties	male	
spk1	dev0613.mp3	彼女は美しい古風な家具をいくつか持っている。			twenties	male	
spk1	dev0614.mp3	平均台の上にまたがりなさい。			twenties	male	
spk1	dev0615.mp3	部屋の中をきちんと整理しなさい。			twenties	male	
spk1	dev0616.mp3	彼ほど平々凡々たる主人公は珍しい。			twenties	male	
spk1	dev0617.mp3	壁にもたれるな。			twenties	male	
spk5	dev0618.mp3	生活扶助、医療扶助、住宅扶助などによって、貧困に陥った人々を、援助している。			twenties	male	
spk1	dev0619.mp3	毎日昼は一時間休みます。			twenties	male	
spk1	dev0620.mp3	氷は毎日相当な距離を漂うこともある。			twenties	male	
spk1	dev0621.mp3	おふろに入るので、服を脱ぎます。			twenties	male	
spk1	dev0622.mp3	でもあいにくの雨で試合は中止になった。			twenties	male	
spk1	dev0623.mp3	兵士たちは故国のために死ぬ覚悟が出来ていた。			twenties	male	
spk1	dev0624.mp3	その車は動こうとしなかった。			twenties	male	
spk1	dev0625.mp3	彼女は裕福な家に生まれ、よい教育を受けた。			twenties	male	
spk1	dev0626.mp3	きのうのテストは易しかったです。			twenties	male	
spk1	dev0627.mp3	彼女は脇の下にバッグを抱えています。			twenties	male	
spk1	dev0628.mp3	父は一日に一箱の煙草を吸う。			twenties	male	
spk1	dev0629.mp3	六日に郵便局で荷物を送りました。			twenties	male	
spk1	dev0630.mp3	そのろくでなしどもはクビになりましたよ。			twenties	male	
spk1	dev0631.mp3	貧困は幸福への障害とはならない。			twenties	male	
spk1	dev0632.mp3	レーザー光線を、レンズで拡散させ、撮影したい物体に当て、その反射光を、半透明なフィルムで受ける。			twenties	male	
spk1	dev0633.mp3	あの坂をのぼれば、海が見える。			twenties	male	
spk1	dev0634.mp3	冬は寒いので、ストーブをつけます。			twenties	male	
spk1	dev0635.mp3	部屋は散らかり放題だった。			twenties	male	
spk7	test0001.mp3	新しい靴をはいて出かけます。			twenties	male	
spk7	test0002.mp3	普段着でおいでください。			twenties	male	
spk7	test0003.mp3	必ずやります。			twenties	male	
spk7	test0004.mp3	ぶらぶらと、球場まで十分足らずの道を歩いていく。			twenties	male	
spk7	test0005.mp3	部屋の中に多くの聴衆がいた。			twenties	male	
spk7	test0006.mp3	彼女は彼を思い切りけとばした。			twenties	male	
spk7	test0007.mp3	暑かったので、家へ帰って、シャワーを浴びました。			twenties	male	
spk7	test0008.mp3	りっぱな大人になりたいです。			twenties	male	
spk7	test0009.mp3	部屋は全く整頓されていなかった。			twenties	male	
spk7	test0010.mp3	布に応じて衣服を裁て。			twenties	male	
spk7	test0011.mp3	父は母を愛している。			twenties	male	
spk7	test0012.mp3	父は私の弟を掌中の玉のようにかわいがった。			twenties	male	
spk7	test0013.mp3	窓口でお金の振り込みをします。			twenties	male	
spk7	test0014.mp3	小林さんは青い傘を持っています。			twenties	male	
spk7	test0015.mp3	父はまだ帰っていません。			twenties	male	
spk7	test0016.mp3	もっと安い服を買います。			twenties	male	
spk7	test0017.mp3	きょうの夕飯はカレーを作ろうと思います。			twenties	male	
spk7	test0018.mp3	暗い部屋で本を読んでいたので、目が疲れました。			twenties	male	
spk7	test0019.mp3	彼女は悲惨な死に方をした。			twenties	male	
spk7	test0020.mp3	風が雪のふきだまりを作った。			twenties	male	
spk7	test0021.mp3	父はまだ休んでいる。			twenties	male	
spk7	test0022.mp3	彼女は風邪を引きやすかった。			twenties	male	
spk7	test0023.mp3	毎日忙しいので、あまり休むことができません。			twenties	male	
spk7	test0024.mp3	事故原因の究明は、急いでもらいたい。			twenties	male	
spk7	test0025.mp3	病気の時見舞いに来てくれてどうもありがとう。			twenties	male	
spk7	test0026.mp3	父はニューヨークへ旅行することになっています。			twenties	male	
spk7	test0027.mp3	今いる市民が逃げ出すという事態が危惧されます。			twenties	male	
spk7	test0028.mp3	物価が上がった。			twenties	male	
spk7	test0029.mp3	腹を立てるのもあたりまえだな。			twenties	male	
spk7	test0030.mp3	分別のある人ならそんなことはいわないだろう。			twenties	male	
spk7	test0031.mp3	空が少し曇ってきました。			twenties	male	
spk7	test0032.mp3	父はふだんバスで事務所へ行きます。			twenties	male	
spk7	test0033.mp3	英語で話すのは難しいです。			twenties	male	
spk7	test0034.mp3	彼女は料理がうまい。			twenties	male	
spk7	test0035.mp3	風が強く吹いている。			twenties	male	
spk7	test0036.mp3	きょうの授業はここまでです。それでは、また来週、会いましょう。			twenties	male	
spk7	test0037.mp3	おとといデパートで新しい靴を買いました。			twenties	male	
spk7	test0038.mp3	私たちは、静かに歩み寄り、頭をさげた。			twenties	male	
spk7	test0039.mp3	主人に甘え、社会に甘え、自分に甘えて、ぬるま湯に、どっぷり浸っている。			twenties	male	
spk7	test0040.mp3	目が悪いので、眼鏡をかけます。			twenties	male	
spk7	test0041.mp3	物事をいいかげんにするな。			twenties	male	
spk7	test0042.mp3	彼女は名前をアンに変えた。			twenties	male	
spk7	test0043.mp3	父は商用で香港に行った。			twenties	male	
spk7	test0044.mp3	不意を打たれて、私は返事に困った。			twenties	male	
spk7	test0045.mp3	彼等はこの陳述が真実であると一人残らず認めた。			twenties	male	
spk7	test0046.mp3	父は昼食を食べるために読書をやめました。			twenties	male	
spk7	test0047.mp3	日本語の勉強は楽しいです。			twenties	male	
spk7	test0048.mp3	彼女は未だかつて北海道へ行ったことがない。			twenties	male	
spk7	test0049.mp3	皆さんが行くなら、わたしも行きます。			twenties	male	
spk7	test0050.mp3	ピラミッドを築くだけの苦労が、そこにそそがれたはずであった。			twenties	male	
spk7	test0051.mp3	わたしは今お金がありません。			twenties	male	
spk7	test0052.mp3	父はその結果に満足だった。			twenties	male	
spk7	test0053.mp3	彼女は流行に敏感である。			twenties	male	
spk7	test0054.mp3	しかし、使徒たちはその危険に気付いた。			twenties	male	
spk7	test0055.mp3	今わたしは四十五キログラムあります。			twenties	male	
spk7	test0056.mp3	月曜日は朝から学校へ行きます。			twenties	male	
spk7	test0057.mp3	はい、そうです。			twenties	male	
spk7	test0058.mp3	父は、アメリカへ行ってしまった。			twenties	male	
spk7	test0059.mp3	父は私にバイクを買ってくれた。			twenties	male	
spk7	test0060.mp3	服は赤、ピンク、青色などであった。			twenties	male	
spk7	test0061.mp3	彼女は病気だったようだ。			twenties	male	
spk7	test0062.mp3	百合が雨のために打ち倒されてしまった。			twenties	male	
spk7	test0063.mp3	あしたイさんに電話をします。			twenties	male	
spk7	test0064.mp3	平和しか世界を救うことはできない。			twenties	male	
spk7	test0065.mp3	氷のような水をものともせずに彼は川へ飛びこんだ。			twenties	male	
spk7	test0066.mp3	彼女は非常に個性的な人だ。			twenties	male	
spk7	test0067.mp3	当時、日本一の長距離バスである。			twenties	male	
spk7	test0068.mp3	夏は毎日帽子をかぶって出かけます。			twenties	male	
spk7	test0069.mp3	はい、わかりました。			twenties	male	
spk7	test0070.mp3	父は、私がハンサムなのを自慢にしている。			twenties	male	
spk7	test0071.mp3	彼女は欲しい物は何でも手にいれようとした。			twenties	male	
spk7	test0072.mp3	病は気から。			twenties	male	
spk7	test0073.mp3	分かりますか。			twenties	male	
spk7	test0074.mp3	わたしの部屋に机やベッドやテレビなどがあります。			twenties	male	
spk7	test0075.mp3	病気のために彼女はパーティーに出席できなかった。			twenties	male	
spk7	test0076.mp3	彼女は来年結婚する。			twenties	male	
spk7	test0077.mp3	わたしはあした大使館へ行きます。			twenties	male	
spk7	test0078.mp3	聞こえる音は時計のカチカチという音だけだった。			twenties	male	
spk7	test0079.mp3	病気が全快なさるように。			twenties	male	
spk7	test0080.mp3	夫はいつもベッドで本を読む。			twenties	male	
spk7	test0081.mp3	父は私の楽観を乱さないことにした。			twenties	male	
spk7	test0082.mp3	もっと安い部屋を探そうと思います。			twenties	male	
spk7	test0083.mp3	真昼の太陽がテニスコートを目も眩むほどに照らしあげた。			twenties	male	
spk7	test0084.mp3	物価を押し上げるのにいくつかの要因が作用した。			twenties	male	
spk7	test0085.mp3	避妊はちゃんとコンドームつけてたのよね？			twenties	male	
spk7	test0086.mp3	父は私にいつも勇敢で快活であれと言いました。			twenties	male	
spk7	test0087.mp3	彼は都市生活の面で便利な面を強調した。			twenties	male	
spk7	test0088.mp3	おそらく、ほかにも、遺書を書いた人はいるはずだ。			twenties	male	
spk7	test0089.mp3	図書館で本を三冊借りました。			twenties	male	
spk7	test0090.mp3	今ちょうど晩ごはんを食べているところです。			twenties	male	
spk7	test0091.mp3	私は、いろいろの弁護を、自分の胸でこしらえてみました。			twenties	male	
spk7	test0092.mp3	老人ホームの場合は、健康器具や、ひざ掛けだ。			twenties	male	
spk7	test0093.mp3	久し振りに、懐かしい人間味に触れて、心和んだ夜だった。			twenties	male	
spk7	test0094.mp3	父は朝食を取りながら、新聞を読みます。			twenties	male	
spk7	test0095.mp3	風にゆれるあの花々をごらんなさい。			twenties	male	
spk7	test0096.mp3	どうして授業を休んだのですか。			twenties	male	
spk7	test0097.mp3	彼女は非常に怖がっているように見える。			twenties	male	
spk7	test0098.mp3	わたしはこの歌がいちばん好きです。			twenties	male	
spk7	test0099.mp3	彼女は目を輝かせて走ってきた。			twenties	male	
spk7	test0100.mp3	彼女は僕に彼女の住所を知っているかと尋ねた。			twenties	male	
spk4	test0101.mp3	ここは大きくてにぎやかな町です。			twenties	male	
spk4	test0102.mp3	こんな黒い財布を探しています。			twenties	male	
spk4	test0103.mp3	このエレベーターは二階から九階まで止まります。			twenties	male	
spk4	test0104.mp3	屋根には、気密式の電動ドリルで穴を開け、生じる粉塵は、どんどん吸引する。			twenties	male	
spk4	test0105.mp3	聞かないでくれ。			twenties	male	
spk4	test0106.mp3	風呂場はどこですか。			twenties	male	
spk4	test0107.mp3	彼女は迷子になった自分の子供を捜しに行った。			twenties	male	
spk4	test0108.mp3	貧乏暇なしですよ。			twenties	male	
spk4	test0109.mp3	検札に来た車掌も、見て見ぬふりである。			twenties	male	
spk4	test0110.mp3	彼女は僕からゆっくり離れていった。			twenties	male	
spk4	test0111.mp3	兵隊が町への道を封鎖した。			twenties	male	
spk4	test0112.mp3	父が病気になったので、私たちは医者を呼びにやった。			twenties	male	
spk4	test0113.mp3	風邪を引いて頭が痛い。			twenties	male	
spk4	test0114.mp3	きのうのパーティーはとても楽しかったです。			twenties	male	
spk4	test0115.mp3	出口のない、飛行中の航空機の異変は、恐怖の極限状況といってよい。			twenties	male	
spk4	test0116.mp3	風が和らいだ。			twenties	male	
spk4	test0117.mp3	父は社長に昇進した。			twenties	male	
spk4	test0118.mp3	先月わたしは会社をやめました。			twenties	male	
spk4	test0119.mp3	夕方犬と公園へ散歩に行きました。			twenties	male	
spk4	test0120.mp3	ゴムをすると確かに性感が落ちるので、出来れば生でしたいです。			twenties	male	
spk4	test0121.mp3	彼女は夫をあごで使う。			twenties	male	
spk4	test0122.mp3	必要があれば私は朝早く出ましょう。			twenties	male	
spk4	test0123.mp3	出かけるとき、電気を消すのを忘れました。			twenties	male	
spk4	test0124.mp3	部屋番号をお願いします。			twenties	male	
spk4	test0125.mp3	図書館で山田さんといっしょに勉強します。			twenties	male	
spk4	test0126.mp3	先生、こちらが私の母です。			twenties	male	
spk4	test0127.mp3	腹の減った男の子たちは、食堂の方へ進んだ。			twenties	male	
spk4	test0128.mp3	来週、美容院で髪を切ろうと思っています。			twenties	male	
spk4	test0129.mp3	わたしは父に花をあげました。			twenties	male	
spk4	test0130.mp3	物価はやがて上がるだろう。			twenties	male	
spk4	test0131.mp3	木村さんはお菓子を七つ作りました。			twenties	male	
spk4	test0132.mp3	そうなんです。			twenties	male	
spk4	test0133.mp3	母に誕生日のプレゼントをあげました。			twenties	male	
spk4	test0134.mp3	部屋の中は、ものすごく静かだった。			twenties	male	
spk4	test0135.mp3	これは日本で売っていない食べ物です。			twenties	male	
spk4	test0136.mp3	新しい道ができたので、村は便利になりました。			twenties	male	
spk4	test0137.mp3	学校は休みです。			twenties	male	
spk4	test0138.mp3	風邪の具合はどうですか。			twenties	male	
spk4	test0139.mp3	部屋には誰もいない。			twenties	male	
spk4	test0140.mp3	彼女を見れば、好きになる。			twenties	male	
spk4	test0141.mp3	わたしは左手ではしを持ちます。			twenties	male	
spk4	test0142.mp3	空が青いです。			twenties	male	
spk4	test0143.mp3	熱いお茶が飲みたいです。			twenties	male	
spk4	test0144.mp3	父は毎週給料の一部を銀行に預金する。			twenties	male	
spk4	test0145.mp3	彼女は涙をこらえることが出来なかった。			twenties	male	
spk4	test0146.mp3	財布をなくしたので、交番へ行きます。			twenties	male	
spk4	test0147.mp3	暑いので、セーターを脱ぎます。			twenties	male	
spk4	test0148.mp3	なぜ日本語を勉強しているんですか。			twenties	male	
spk4	test0149.mp3	父は泳げますが、母は泳げません。			twenties	male	
spk4	test0150.mp3	冬になると、日本の北側はとても寒いです。			twenties	male	
spk4	test0151.mp3	いつもこの鉛筆を使っていたので、短くなりました。			twenties	male	
spk4	test0152.mp3	彼女を笑わずにはいられない。			twenties	male	
spk4	test0153.mp3	本棚にたくさん本が並べてあります。			twenties	male	
spk4	test0154.mp3	夫は自分の計画を変えて妻の計画に合わせた。			twenties	male	
spk4	test0155.mp3	人々は非難し、悩みながら、歩み寄っていく。			twenties	male	
spk4	test0156.mp3	夫はたまに御酒をたしなみます。			twenties	male	
spk4	test0157.mp3	職員室でも、枠を取り払って、何でもしゃべりあう。			twenties	male	
spk4	test0158.mp3	彼女は夫が金持ちであることを自慢している。			twenties	male	
spk4	test0159.mp3	部屋におられない間に勝手に辞書をお借りしました。			twenties	male	
spk4	test0160.mp3	彼女は目に涙を浮かべてその事故について語った。			twenties	male	
spk4	test0161.mp3	副作用としては、視力障害があります。			twenties	male	
spk4	test0162.mp3	わたしは時々この八百屋で買い物をします。			twenties	male	
spk4	test0163.mp3	雑誌は図書館で借りることができません。			twenties	male	
spk4	test0164.mp3	彼等はシャベルで除雪していた。			twenties	male	
spk4	test0165.mp3	不作で食料がひどく不足した。			twenties	male	
spk4	test0166.mp3	父は私の愚かな質問に苦しまれた。			twenties	male	
spk4	test0167.mp3	彼女を町まで乗せてやった。			twenties	male	
spk4	test0168.mp3	氷がない、その上今日はアイスティーを飲むには寒すぎる。			twenties	male	
spk4	test0169.mp3	不正を働くと逮捕される危険がある。			twenties	male	
spk4	test0170.mp3	本屋で雑誌を買いました。			twenties	male	
spk4	test0171.mp3	平和会談は今週始まる。			twenties	male	
spk4	test0172.mp3	あの八百屋のおじさんはいつも元気です。			twenties	male	
spk4	test0173.mp3	熱でうるんだ青い空に、積乱雲がある。			twenties	male	
spk4	test0174.mp3	父の死のショックが後を引いていて、彼女は外出する気力がなかった。			twenties	male	
spk4	test0175.mp3	日本の料理はどうですか。			twenties	male	
spk4	test0176.mp3	日本の球場では、よく、口汚いののしり声が、耳に入る。			twenties	male	
spk4	test0177.mp3	サブマリンのペリスコープが水中からにょっきり突き出ていた。			twenties	male	
spk4	test0178.mp3	不動産業者には独立した仲買人がたくさんいる。			twenties	male	
spk4	test0179.mp3	氷山が海岸に打ち上げられていた。			twenties	male	
spk4	test0180.mp3	貧しかったけれども、彼は人から金を借りなかった。			twenties	male	
spk4	test0181.mp3	分別ある人というのは良識を働かす人である。			twenties	male	
spk4	test0182.mp3	風邪をひく心配は少しもありません。			twenties	male	
spk4	test0183.mp3	アルミニウム、マグネシウム、シリコンなどの粉末が爆発する。			twenties	male	
spk4	test0184.mp3	父は私が泳ぎに行くのを許してくれた。			twenties	male	
spk4	test0185.mp3	私が一番古い友達というので、碑文に、一筆すすめられた。			twenties	male	
spk4	test0186.mp3	あの人はとても足が長いです。			twenties	male	
spk4	test0187.mp3	彼女は夜更かしする習慣がある。			twenties	male	
spk4	test0188.mp3	かばんの中にノートがあります。			twenties	male	
spk4	test0189.mp3	女性とは逆で、何とか常識を破って、めだってやろうと、意気込む人がほとんどだ。			twenties	male	
spk4	test0190.mp3	仕事が終わったら、夕飯を食べに行きます。			twenties	male	
spk4	test0191.mp3	貧しさのため彼は研究を続けることが出来なかった。			twenties	male	
spk4	test0192.mp3	部屋をのぞいてみたら、だれもいなかった。			twenties	male	
spk4	test0193.mp3	冬が長くて辛ければ、それだけ、歓びも大きいのだ。			twenties	male	
spk4	test0194.mp3	氷が薄すぎてスケートができません。			twenties	male	
spk4	test0195.mp3	ゆらゆら電球が揺れて、影が、草の上をちらちらした。			twenties	male	
spk4	test0196.mp3	テストはできましたか。それでは、出してください。			twenties	male	
spk4	test0197.mp3	あそこに丸い箱があります。			twenties	male	
spk4	test0198.mp3	必ず変化が起こるだろう。			twenties	male	
spk4	test0199.mp3	彼女は毎日ピアノの練習をした。			twenties	male	
spk4	test0200.mp3	父は滅多に日曜日に外出することはない。			twenties	male	
spk7	test0201.mp3	普通、中距離トラックのドライバーは、中年の人が多い。			twenties	male	
spk7	test0202.mp3	ギンザケの卵を輸入して、ふ化させ、海中で育てる養殖も始まっている。			twenties	male	
spk7	test0203.mp3	あした忘れないで、本を返します。			twenties	male	
spk7	test0204.mp3	彼女を電話に出して頂けませんか。			twenties	male	
spk7	test0205.mp3	悲劇の本質は、短編小説のそれと同じように、その葛藤である。			twenties	male	
spk7	test0206.mp3	彼女は悲観する傾向がある。			twenties	male	
spk7	test0207.mp3	彼女は母親とそっくりだ。			twenties	male	
spk7	test0208.mp3	彼女は役に立つと私は思ったのだが、実際はいない方がよかったのだ。			twenties	male	
spk7	test0209.mp3	今、何時何分ですか。			twenties	male	
spk7	test0210.mp3	わたしは静かできれいな所に住みたいです。			twenties	male	
spk7	test0211.mp3	兵隊達は全員その地帯の地図を持っていた。			twenties	male	
spk7	test0212.mp3	この料理は家庭で作れます。			twenties	male	
spk7	test0213.mp3	東京は晴れでした。			twenties	male	
spk7	test0214.mp3	分かりました。気をつけて運転してください。			twenties	male	
spk7	test0215.mp3	うちの中学は弁当制で、持って行けない場合は、五十円の学校販売のパンを買う。			twenties	male	
spk7	test0216.mp3	夫は失業中で職を探しています。			twenties	male	
spk7	test0217.mp3	彼女は六歳でピアノのけいこを始めた。			twenties	male	
spk7	test0218.mp3	野球の後のビールぐらい、うまいものはない。			twenties	male	
spk7	test0219.mp3	大昔のフィリピンには、豊かな土地があった。			twenties	male	
spk7	test0220.mp3	彼女は憂鬱状態になることがある。			twenties	male	
spk7	test0221.mp3	いずれは、ハワイやカリフォルニアなど、日本人が多く住む、暑い土地で育ててみたい。			twenties	male	
spk7	test0222.mp3	貧しい人が必ずしも不幸なわけではないと言われている。			twenties	male	
spk7	test0223.mp3	副作用はありませんか。			twenties	male	
spk7	test0224.mp3	あの人は足が細くて、長いです。			twenties	male	
spk7	test0225.mp3	デパートで来年のカレンダーを買いました。			twenties	male	
spk7	test0226.mp3	先月隣の町にデパートができました。			twenties	male	
spk7	test0227.mp3	彼女は僕に会うたびに微笑みかける。			twenties	male	
spk7	test0228.mp3	それはきょうの新聞です。			twenties	male	
spk7	test0229.mp3	部屋には明かりがついていた。			twenties	male	
spk7	test0230.mp3	お化けはお化けでも、目もなければ鼻もない、ノッペラボウの一種である。			twenties	male	
spk7	test0231.mp3	電車に乗るとき、切符を買います。			twenties	male	
spk7	test0232.mp3	父は禁煙を決意した。			twenties	male	
spk7	test0233.mp3	彼女は盲人のために募金をしている。			twenties	male	
spk7	test0234.mp3	ゆうべは疲れていたので、早く寝ました。			twenties	male	
spk7	test0235.mp3	父は私の腕をつかまえた。			twenties	male	
spk7	test0236.mp3	時々、狭い敷地の罅の入った直線コースで、子供が、キャッチボールをやっている。			twenties	male	
spk7	test0237.mp3	彼女名簿に載っていますよ。			twenties	male	
spk7	test0238.mp3	外人サンは、完璧主義である。			twenties	male	
spk7	test0239.mp3	あそこにエレベーターがあります。			twenties	male	
spk7	test0240.mp3	この大学は古くて、有名です。			twenties	male	
spk7	test0241.mp3	田中さんに手紙を出します。			twenties	male	
spk7	test0242.mp3	翌年、父の選挙を手伝って、遊説行脚のマネージャーを勤めた。			twenties	male	
spk7	test0243.mp3	彼女は服にたくさん金を使う。			twenties	male	
spk7	test0244.mp3	きのうはテレビを見ました。それから、日本語を勉強しました。			twenties	male	
spk7	test0245.mp3	答えを書いた紙を出してください。			twenties	male	
spk7	test0246.mp3	毎晩寝る前に本を読みます。			twenties	male	
spk7	test0247.mp3	旅行でたくさん写真を撮りました。			twenties	male	
spk7	test0248.mp3	彼女は病気の振りをした。			twenties	male	
spk7	test0249.mp3	七日までにお金の振り込みをします。			twenties	male	
spk7	test0250.mp3	部屋に入ってきた時、彼女は私ににっこりと笑った。			twenties	male	
spk7	test0251.mp3	彼女は有能で頼りになる助手だ。			twenties	male	
spk7	test0252.mp3	負債は帳消しにするしかなかった。			twenties	male	
spk7	test0253.mp3	人が大勢死にました。			twenties	male	
spk7	test0254.mp3	彼女は不愉快に思ったとしても、決して顔に出さなかった。			twenties	male	
